{
  "$schema": "./sca-rules.schema.json",
  "version": "1.3",
  "tool": {
    "name": "StaticCodeAnalyser",
    "version": "0.9.1",
    "informationUri": "https://github.com/nrodear/StaticCodeAnalyser"
  },
  "profiles": {
    "ide-fast": [
      "MemoryLeak", "SQLInjection", "HardcodedSecret", "FormatMismatch",
      "NilDeref", "MissingFinally", "DivByZero", "DeadCode",
      "DebugOutput", "FileReadError",
      "DfmHardcodedDbCreds", "DfmDeadEvent", "DfmDuplicateBinding",
      "DfmSchemaMismatch", "DfmCircularDataSource", "DfmSqlFromUserInput",
      "DfmRequiredFieldUnbound", "DfmRequiredFieldNotVisible",
      "DfmCrossFormCoupling", "DfmActionMismatch"
    ],
    "security": [
      "SQLInjection", "HardcodedSecret", "HardcodedPath",
      "DfmHardcodedDbCreds", "DfmSqlFromUserInput"
    ],
    "bugs-only": [
      "MemoryLeak", "FormatMismatch", "NilDeref", "DivByZero",
      "SQLInjection", "HardcodedSecret", "FileReadError",
      "DfmDuplicateBinding", "DfmDeadEvent", "DfmSchemaMismatch",
      "DfmCircularDataSource", "DfmRequiredFieldUnbound",
      "DfmRequiredFieldNotVisible", "DfmCrossFormCoupling",
      "DfmActionMismatch"
    ],
    "code-quality": [
      "EmptyExcept", "UnusedUses", "MissingFinally", "DeadCode",
      "LongMethod", "LongParamList", "MagicNumber", "DebugOutput",
      "DeepNesting", "TodoComment", "EmptyMethod", "CyclomaticComplexity",
      "DuplicateString", "DuplicateBlock",
      "DfmDefaultName", "DfmHardcodedCaption", "DfmOrphanHandler",
      "DfmEmptyBoundEvent", "DfmFieldTypeMismatch", "DfmTabOrderConflict",
      "DfmForbiddenClass", "DfmDbInUiForm", "DfmLayerViolation",
      "DfmGodHandler"
    ],
    "dfm-only": [
      "DfmDefaultName", "DfmHardcodedCaption", "DfmHardcodedDbCreds",
      "DfmDuplicateBinding", "DfmDeadEvent", "DfmOrphanHandler",
      "DfmEmptyBoundEvent", "DfmSchemaMismatch", "DfmCircularDataSource",
      "DfmSqlFromUserInput", "DfmRequiredFieldUnbound",
      "DfmRequiredFieldNotVisible", "DfmFieldTypeMismatch",
      "DfmTabOrderConflict", "DfmForbiddenClass", "DfmDbInUiForm",
      "DfmCrossFormCoupling", "DfmLayerViolation", "DfmGodHandler",
      "DfmActionMismatch"
    ],
    "default": ["*"],
    "strict":  ["*", "UnusedUses"]
  },
  "rules": [
    {
      "id": "SCA001",
      "kind": "MemoryLeak",
      "name": "Object created without try/finally",
      "shortDescription": "Object created but never freed (potential memory leak)",
      "fullDescription": "TObject.Create (or LeakyClass.Create) without a protective try/finally block leaks the instance when subsequent code raises an exception. The Free call must run regardless of how the protected block exits.",
      "defaultSeverity": "Error",
      "type": "Bug",
      "tags": ["memory", "resource-leak"],
      "cwe": ["CWE-401"],
      "configKey": "[Detectors] LeakyClasses",
      "detectorUnit": "uLeakDetector2.pas",
      "examples": {
        "bad":  "list := TStringList.Create;\nDoStuff(list);   // <-- exception here leaks list",
        "good": "list := TStringList.Create;\ntry\n  DoStuff(list);\nfinally\n  list.Free;\nend;"
      },
      "cleanCodeAttribute": "LAWFUL",
      "impacts": [
        { "softwareQuality": "RELIABILITY", "severity": "HIGH" }
      ]
    },
    {
      "id": "SCA002",
      "kind": "EmptyExcept",
      "name": "Empty except block",
      "shortDescription": "Empty except block silently swallows every exception",
      "fullDescription": "An except-block with no statements catches every exception including unexpected ones (EAccessViolation, EOutOfMemory). Bugs become invisible. At minimum log the exception or re-raise.",
      "defaultSeverity": "Warning",
      "type": "Code Smell",
      "tags": ["error-handling"],
      "cwe": ["CWE-390"],
      "detectorUnit": "uCodeSmells2.pas",
      "examples": {
        "bad":  "try DoStuff except end;",
        "good": "try DoStuff except on E: Exception do LogError(E.Message); end;"
      },
      "cleanCodeAttribute": "LAWFUL",
      "impacts": [
        { "softwareQuality": "RELIABILITY", "severity": "MEDIUM" }
      ]
    },
    {
      "id": "SCA003",
      "kind": "SQLInjection",
      "name": "SQL string built via concatenation",
      "shortDescription": "SQL string concatenated with '+' from user-controllable input (injection risk)",
      "fullDescription": "Building SQL via 'WHERE x=' + user_input enables SQL injection if the input is untrusted. Use parameterized queries (Params.ParamByName(...).Value := ...) instead.",
      "defaultSeverity": "Error",
      "type": "Vulnerability",
      "tags": ["sql", "injection", "security"],
      "cwe": ["CWE-89"],
      "owasp": ["A03:2021-Injection"],
      "detectorUnit": "uSQLInjection.pas",
      "examples": {
        "bad":  "Query.SQL.Text := 'SELECT * FROM Users WHERE Name=''' + UserName + '''';",
        "good": "Query.SQL.Text := 'SELECT * FROM Users WHERE Name=:n';\nQuery.ParamByName('n').AsString := UserName;"
      },
      "cleanCodeAttribute": "LAWFUL",
      "impacts": [
        { "softwareQuality": "SECURITY", "severity": "HIGH" }
      ]
    },
    {
      "id": "SCA004",
      "kind": "HardcodedSecret",
      "name": "Hardcoded credential / API token",
      "shortDescription": "Password / API key / token as string literal in source code",
      "fullDescription": "Credentials in source code end up in version control, build artifacts, decompilers, and stack traces. Move secrets to environment variables, OS credential store, or encrypted configuration.",
      "defaultSeverity": "Error",
      "type": "Vulnerability",
      "tags": ["credentials", "security"],
      "cwe": ["CWE-798"],
      "owasp": ["A07:2021-Identification-and-Authentication-Failures"],
      "detectorUnit": "uHardcodedSecret.pas",
      "examples": {
        "bad":  "Password := 'admin123';",
        "good": "Password := GetEnvironmentVariable('DB_PASSWORD');"
      },
      "cleanCodeAttribute": "LAWFUL",
      "impacts": [
        { "softwareQuality": "SECURITY", "severity": "BLOCKER" }
      ]
    },
    {
      "id": "SCA005",
      "kind": "FormatMismatch",
      "name": "Format() placeholder count mismatch",
      "shortDescription": "Format() / FormatUtf8() placeholder count does not match argument count",
      "fullDescription": "Mismatched placeholders cause EConvertError at runtime. Detector handles RTL Format (%s/%d/...) and mORMot bare-% style (FormatUtf8/FormatString).",
      "defaultSeverity": "Error",
      "type": "Bug",
      "tags": ["string-formatting"],
      "configKey": "[Detectors] FormatFunctions",
      "detectorUnit": "uFormatMismatch.pas",
      "examples": {
        "bad":  "Format('%s is %d', [Name]);   // <-- Age missing",
        "good": "Format('%s is %d', [Name, Age]);"
      },
      "cleanCodeAttribute": "LOGICAL",
      "impacts": [
        { "softwareQuality": "RELIABILITY", "severity": "MEDIUM" }
      ]
    },
    {
      "id": "SCA006",
      "kind": "FileReadError",
      "name": "File could not be read or parsed",
      "shortDescription": "Parser/IO error - source file unreadable or syntactically broken",
      "fullDescription": "Special-case finding (no code defect): the file could not be loaded or the lexer/parser failed. Often indicates encoding issues, includes that don't resolve, or genuine syntax errors.",
      "defaultSeverity": "Error",
      "type": "File Error",
      "tags": ["parser", "io"],
      "detectorUnit": "(parser)",
      "examples": {
        "bad":  "(file is not valid UTF-8 or has lexer-breaking content)",
        "good": "(check encoding, fix syntax)"
      },
      "cleanCodeAttribute": "LAWFUL",
      "impacts": [
        { "softwareQuality": "RELIABILITY", "severity": "INFO" }
      ]
    },
    {
      "id": "SCA007",
      "kind": "UnusedUses",
      "name": "Unused unit in uses clause",
      "shortDescription": "Uses-entry possibly unused (no identifier from it referenced)",
      "fullDescription": "Heuristic: scans for any identifier from the used unit. False positives possible for units that only register classes / initialize global state via initialization sections.",
      "defaultSeverity": "Hint",
      "type": "Code Smell",
      "tags": ["dead-code", "uses-cleanup"],
      "detectorUnit": "uUnusedUses.pas",
      "examples": {
        "bad":  "uses ..., MyUnusedHelper, ...;",
        "good": "(remove if truly unused; otherwise add a comment why it stays)"
      },
      "cleanCodeAttribute": "FOCUSED",
      "impacts": [
        { "softwareQuality": "MAINTAINABILITY", "severity": "LOW" }
      ]
    },
    {
      "id": "SCA008",
      "kind": "NilDeref",
      "name": "Possible nil-dereference",
      "shortDescription": "Access to a variable that may be nil at this point",
      "fullDescription": "Variable was assigned a value that could be nil (e.g. Find...-method returning nil) and is dereferenced without prior nil-check. Crashes with EAccessViolation at runtime.",
      "defaultSeverity": "Warning",
      "type": "Bug",
      "tags": ["nil-safety"],
      "cwe": ["CWE-476"],
      "detectorUnit": "uNilDeref.pas",
      "examples": {
        "bad":  "obj := FindObject(id);\nobj.DoStuff;   // <-- AV if FindObject returns nil",
        "good": "obj := FindObject(id);\nif Assigned(obj) then obj.DoStuff;"
      },
      "cleanCodeAttribute": "LOGICAL",
      "impacts": [
        { "softwareQuality": "RELIABILITY", "severity": "HIGH" }
      ]
    },
    {
      "id": "SCA009",
      "kind": "MissingFinally",
      "name": "Object created without protective try/finally",
      "shortDescription": ".Create call without surrounding try/finally - leak risk on exception",
      "fullDescription": "Similar to MemoryLeak but checked structurally: any .Create followed by code without an enclosing try/finally is flagged regardless of whether Free is called eventually.",
      "defaultSeverity": "Warning",
      "type": "Code Smell",
      "tags": ["memory", "exception-safety"],